{
  "schema_version": "openpatch.bridge_latest.v1",
  "project": "webai-transfer",
  "latest_round": "r001",
  "status": "uploaded",
  "latest": {
    "project": "webai-transfer",
    "round_id": "r001",
    "status": "uploaded",
    "file_sha256": "abc123",
    "receipt_path": "/mnt/data/openpatch_v4_bridge_test/receipts/webai-transfer/r001.json",
    "received_at": "2026-05-05T23:31:10.997Z"
  },
  "recent_rounds": [
    {
      "project": "webai-transfer",
      "round_id": "r001",
      "status": "uploaded",
      "file_sha256": "abc123",
      "receipt_path": "/mnt/data/openpatch_v4_bridge_test/receipts/webai-transfer/r001.json",
      "received_at": "2026-05-05T23:31:10.997Z"
    }
  ],
  "codex_next_query": "/latest?project=webai-transfer",
  "updated_at": "2026-05-05T23:31:10.998Z"
}
